{
  "$schema": "https://json-schema.org/draft/2020-12/schema",
  "$id": "https://runcost.dev/schemas/fixture.schema.json",
  "title": "ProviderResponseFixture",
  "type": "object",
  "additionalProperties": false,
  "required": ["name", "description", "metadata", "input", "expected"],
  "properties": {
    "name": {
      "type": "string",
      "minLength": 1
    },
    "description": {
      "type": "string",
      "minLength": 1
    },
    "metadata": {
      "type": "object",
      "additionalProperties": false,
      "required": ["requirement_ids", "provider", "surface", "scenario", "tags", "expected_languages"],
      "properties": {
        "requirement_ids": {
          "type": "array",
          "minItems": 1,
          "items": {
            "type": "string",
            "minLength": 1
          }
        },
        "provider": {
          "type": "string",
          "minLength": 1
        },
        "surface": {
          "type": "string",
          "minLength": 1
        },
        "scenario": {
          "type": "string",
          "enum": [
            "aggregation",
            "attribution",
            "batch",
            "budget",
            "conformance",
            "debug_trace",
            "discount",
            "framework_adapter",
            "long_context",
            "normalized_usage",
            "provider_reported",
            "raw_provider_response",
            "service_mode",
            "service_tier",
            "source_adapter",
            "source_priority",
            "strict_error",
            "telemetry",
            "warning"
          ]
        },
        "tags": {
          "type": "array",
          "minItems": 1,
          "items": {
            "type": "string",
            "minLength": 1
          }
        },
        "expected_languages": {
          "type": "array",
          "minItems": 1,
          "items": {
            "type": "string",
            "enum": ["python", "javascript", "go"]
          }
        }
      }
    },
    "input": {
      "type": "object",
      "additionalProperties": true
    },
    "expected": {
      "type": "object",
      "additionalProperties": true
    }
  }
}
