{
  "name": "meta-reviewed-preview-snapshot-adapter",
  "description": "Maps non-authoritative reviewed Meta Model API public-preview pricing rows into canonical price cards for opt-in Muse Spark estimates.",
  "metadata": {
    "requirement_ids": [
      "RC-FIXTURE-CONFORMANCE",
      "RC-SOURCE-ADAPTER"
    ],
    "provider": "meta",
    "surface": "meta.responses",
    "scenario": "source_adapter",
    "tags": [
      "component:input_cache_read_tokens",
      "component:input_uncached_tokens",
      "component:output_reasoning_tokens",
      "component:output_text_tokens",
      "meta",
      "source:reviewed-preview",
      "source_adapter"
    ],
    "expected_languages": [
      "python",
      "javascript",
      "go"
    ]
  },
  "input": {
    "usage_ledger": {
      "schema_version": "0.1",
      "provider": "meta",
      "surface": "meta.responses",
      "model": {
        "requested": "meta/muse-spark-1.1",
        "returned": "meta/muse-spark-1.1",
        "billed": "meta/muse-spark-1.1",
        "alias_resolution": "none"
      },
      "components": [
        {
          "name": "input_uncached_tokens",
          "quantity": "1000",
          "unit": "token"
        },
        {
          "name": "input_cache_read_tokens",
          "quantity": "100",
          "unit": "token"
        },
        {
          "name": "output_text_tokens",
          "quantity": "1000",
          "unit": "token"
        },
        {
          "name": "output_reasoning_tokens",
          "quantity": "100",
          "unit": "token"
        }
      ]
    },
    "price_source": {
      "type": "official-snapshot",
      "data": {
        "schema_version": "0.1",
        "provider": "meta",
        "source": {
          "name": "Meta Model API reviewed public-preview pricing snapshot",
          "url": "https://dev.meta.ai/docs/getting-started/sdks",
          "retrieved_at": "2026-07-09T00:00:00Z",
          "version": "2026-07-09",
          "license": "reviewed"
        },
        "rows": [
          {
            "price_card_id": "meta:muse-spark-1.1:reviewed-preview-snapshot",
            "model": "muse-spark-1.1",
            "aliases": [
              "Muse Spark 1.1",
              "meta/muse-spark-1.1",
              "muse-spark-1_1"
            ],
            "input": "1.25",
            "cached_input": "1.25",
            "output": "4.25",
            "reasoning": "4.25",
            "effective": {
              "from": "2026-07-09"
            },
            "source_label": "Meta Model API public preview pricing",
            "capabilities": {
              "pricing_dimensions": [
                "token"
              ],
              "cache_read_priced_as_input": true,
              "reasoning_priced_as_output": true,
              "official_docs_login_gated_in_codex": true,
              "primary_pricing_source_verified": false
            },
            "notes": "Meta docs were login-gated in Codex on 2026-07-09; public-preview prices were cross-checked against Axios and Reuters/WTVB reporting."
          }
        ]
      }
    }
  },
  "expected": {
    "cost_ledger": {
      "schema_version": "0.1",
      "provider": "meta",
      "surface": "meta.responses",
      "model": {
        "requested": "meta/muse-spark-1.1",
        "returned": "meta/muse-spark-1.1",
        "billed": "muse-spark-1.1",
        "alias_resolution": "source_exact"
      },
      "currency": "USD",
      "components": [
        {
          "name": "input_uncached_tokens",
          "quantity": "1000",
          "unit": "token",
          "unit_price": "0.00000125",
          "cost": "0.00125",
          "price_card_id": "meta:muse-spark-1.1:reviewed-preview-snapshot",
          "discount_eligible": true
        },
        {
          "name": "input_cache_read_tokens",
          "quantity": "100",
          "unit": "token",
          "unit_price": "0.00000125",
          "cost": "0.000125",
          "price_card_id": "meta:muse-spark-1.1:reviewed-preview-snapshot",
          "discount_eligible": true
        },
        {
          "name": "output_text_tokens",
          "quantity": "1000",
          "unit": "token",
          "unit_price": "0.00000425",
          "cost": "0.00425",
          "price_card_id": "meta:muse-spark-1.1:reviewed-preview-snapshot",
          "discount_eligible": true
        },
        {
          "name": "output_reasoning_tokens",
          "quantity": "100",
          "unit": "token",
          "unit_price": "0.00000425",
          "cost": "0.000425",
          "price_card_id": "meta:muse-spark-1.1:reviewed-preview-snapshot",
          "discount_eligible": true
        }
      ],
      "total": "0.00605",
      "price_sources": [
        {
          "name": "Meta Model API reviewed public-preview pricing snapshot",
          "url": "https://dev.meta.ai/docs/getting-started/sdks",
          "retrieved_at": "2026-07-09T00:00:00Z",
          "version": "2026-07-09",
          "license": "reviewed"
        }
      ],
      "applied_discounts": [],
      "warnings": [
        {
          "code": "alias_inferred",
          "message": "Resolved model alias meta/muse-spark-1.1 to billed model muse-spark-1.1.",
          "metadata": {
            "requested_model": "meta/muse-spark-1.1",
            "billed_model": "muse-spark-1.1"
          }
        }
      ]
    }
  }
}
