{
  "name": "unpriced-component-compatibility",
  "description": "Compatibility mode prices known components and warns for a missing component price.",
  "metadata": {
    "requirement_ids": [
      "RC-FIXTURE-CONFORMANCE",
      "RC-WARNING-MODE"
    ],
    "provider": "openai",
    "surface": "openai.responses",
    "scenario": "warning",
    "tags": [
      "component:input_uncached_tokens",
      "component:output_reasoning_tokens",
      "warning",
      "warning:component_unpriced"
    ],
    "expected_languages": [
      "python",
      "javascript",
      "go"
    ]
  },
  "input": {
    "usage_ledger": {
      "schema_version": "0.1",
      "provider": "openai",
      "surface": "openai.responses",
      "model": {
        "requested": "gpt-fixture",
        "returned": "gpt-fixture",
        "billed": "gpt-fixture",
        "alias_resolution": "none"
      },
      "components": [
        {
          "name": "input_uncached_tokens",
          "quantity": "10",
          "unit": "token"
        },
        {
          "name": "output_reasoning_tokens",
          "quantity": "5",
          "unit": "token"
        }
      ]
    },
    "price_cards": [
      {
        "schema_version": "0.1",
        "id": "openai:gpt-fixture:partial",
        "provider": "openai",
        "surface": "openai.responses",
        "model": "gpt-fixture",
        "components": [
          {
            "usage_component": "input_uncached_tokens",
            "unit": "token",
            "price": {
              "amount": "0.01",
              "currency": "USD",
              "per": "1"
            }
          }
        ],
        "source": {
          "name": "fixture",
          "retrieved_at": "2026-05-24T00:00:00Z"
        }
      }
    ]
  },
  "expected": {
    "cost_ledger": {
      "schema_version": "0.1",
      "provider": "openai",
      "surface": "openai.responses",
      "model": {
        "requested": "gpt-fixture",
        "returned": "gpt-fixture",
        "billed": "gpt-fixture",
        "alias_resolution": "none"
      },
      "currency": "USD",
      "components": [
        {
          "name": "input_uncached_tokens",
          "quantity": "10",
          "unit": "token",
          "unit_price": "0.01",
          "cost": "0.1",
          "price_card_id": "openai:gpt-fixture:partial",
          "discount_eligible": true
        }
      ],
      "total": "0.1",
      "price_sources": [
        {
          "name": "fixture",
          "retrieved_at": "2026-05-24T00:00:00Z"
        }
      ],
      "applied_discounts": [],
      "warnings": [
        {
          "code": "component_unpriced",
          "message": "No price found for output_reasoning_tokens (token)."
        }
      ]
    }
  }
}
