{
  "name": "service-tier-default-standard-selection",
  "description": "Treats absent service-tier context as standard when selecting tier-specific price cards.",
  "metadata": {
    "requirement_ids": [
      "RC-FIXTURE-CONFORMANCE",
      "RC-SERVICE-TIER"
    ],
    "provider": "openai",
    "surface": "openai.responses",
    "scenario": "service_tier",
    "tags": [
      "component:output_text_tokens",
      "service_tier"
    ],
    "expected_languages": [
      "python",
      "javascript",
      "go"
    ]
  },
  "input": {
    "usage_ledger": {
      "schema_version": "0.1",
      "provider": "openai",
      "surface": "openai.responses",
      "model": {
        "requested": "gpt-tiered",
        "billed": "gpt-tiered",
        "alias_resolution": "none"
      },
      "components": [
        {
          "name": "output_text_tokens",
          "quantity": "100",
          "unit": "token"
        }
      ]
    },
    "price_cards": [
      {
        "schema_version": "0.1",
        "id": "openai:gpt-tiered:flex",
        "provider": "openai",
        "surface": "openai.responses",
        "model": "gpt-tiered",
        "service_tier": "flex",
        "components": [
          {
            "usage_component": "output_text_tokens",
            "unit": "token",
            "price": {
              "amount": "5",
              "currency": "USD",
              "per": "1000000"
            }
          }
        ],
        "source": {
          "name": "fixture",
          "retrieved_at": "2026-06-16T00:00:00Z"
        }
      },
      {
        "schema_version": "0.1",
        "id": "openai:gpt-tiered:standard",
        "provider": "openai",
        "surface": "openai.responses",
        "model": "gpt-tiered",
        "service_tier": "standard",
        "components": [
          {
            "usage_component": "output_text_tokens",
            "unit": "token",
            "price": {
              "amount": "10",
              "currency": "USD",
              "per": "1000000"
            }
          }
        ],
        "source": {
          "name": "fixture",
          "retrieved_at": "2026-06-16T00:00:00Z"
        }
      }
    ]
  },
  "expected": {
    "cost_ledger": {
      "schema_version": "0.1",
      "provider": "openai",
      "surface": "openai.responses",
      "model": {
        "requested": "gpt-tiered",
        "billed": "gpt-tiered",
        "alias_resolution": "none"
      },
      "currency": "USD",
      "components": [
        {
          "name": "output_text_tokens",
          "quantity": "100",
          "unit": "token",
          "unit_price": "0.00001",
          "cost": "0.001",
          "price_card_id": "openai:gpt-tiered:standard",
          "discount_eligible": true
        }
      ],
      "total": "0.001",
      "price_sources": [
        {
          "name": "fixture",
          "retrieved_at": "2026-06-16T00:00:00Z"
        }
      ],
      "applied_discounts": [],
      "warnings": []
    }
  }
}
