{
  "name": "xai-grok-4-3-reasoning-output-pricing",
  "description": "Prices reported Grok 4.3 reasoning tokens at the output-token rate when the xAI price card omits a separate reasoning component.",
  "metadata": {
    "requirement_ids": [
      "RC-FIXTURE-CONFORMANCE",
      "RC-RAW-EXTRACTOR"
    ],
    "provider": "xai",
    "surface": "openai.responses",
    "scenario": "raw_provider_response",
    "tags": [
      "component:input_cache_read_tokens",
      "component:input_uncached_tokens",
      "component:output_reasoning_tokens",
      "component:output_text_tokens",
      "raw_provider_response",
      "reasoning",
      "xai"
    ],
    "expected_languages": [
      "python",
      "javascript",
      "go"
    ]
  },
  "input": {
    "raw_response": {
      "id": "resp_xai_reasoning_pricing",
      "object": "response",
      "model": "grok-4.3",
      "output": [
        {
          "type": "message",
          "id": "msg_xai_reasoning_pricing",
          "role": "assistant",
          "content": [
            {
              "type": "output_text",
              "text": "fixture"
            }
          ]
        }
      ],
      "usage": {
        "input_tokens": 1000,
        "input_tokens_details": {
          "cached_tokens": 100
        },
        "output_tokens": 200,
        "output_tokens_details": {
          "reasoning_tokens": 50
        },
        "total_tokens": 1200
      }
    },
    "extract": {
      "provider": "xai",
      "surface": "openai.responses",
      "model": "grok-4.3"
    },
    "price_cards": [
      {
        "schema_version": "0.1",
        "id": "xai:grok-4.3:official-fixture",
        "provider": "xai",
        "surface": "openai.responses",
        "model": "grok-4.3",
        "components": [
          {
            "usage_component": "input_uncached_tokens",
            "unit": "token",
            "price": {
              "amount": "1.25",
              "currency": "USD",
              "per": "1000000"
            }
          },
          {
            "usage_component": "input_cache_read_tokens",
            "unit": "token",
            "price": {
              "amount": "0.20",
              "currency": "USD",
              "per": "1000000"
            }
          },
          {
            "usage_component": "output_text_tokens",
            "unit": "token",
            "price": {
              "amount": "2.50",
              "currency": "USD",
              "per": "1000000"
            }
          }
        ],
        "source": {
          "name": "xAI pricing page",
          "url": "https://docs.x.ai/developers/pricing",
          "retrieved_at": "2026-06-07T00:00:00Z"
        },
        "metadata": {
          "source_capabilities": {
            "notes": "xAI publishes input, cached input, and output token rates; reasoning tokens are billed as model token usage."
          }
        }
      }
    ]
  },
  "expected": {
    "cost_ledger": {
      "schema_version": "0.1",
      "provider": "xai",
      "surface": "openai.responses",
      "model": {
        "requested": "grok-4.3",
        "returned": "grok-4.3",
        "billed": "grok-4.3",
        "alias_resolution": "none"
      },
      "currency": "USD",
      "components": [
        {
          "name": "input_uncached_tokens",
          "quantity": "900",
          "unit": "token",
          "unit_price": "0.00000125",
          "cost": "0.001125",
          "price_card_id": "xai:grok-4.3:official-fixture",
          "discount_eligible": true
        },
        {
          "name": "input_cache_read_tokens",
          "quantity": "100",
          "unit": "token",
          "unit_price": "0.0000002",
          "cost": "0.00002",
          "price_card_id": "xai:grok-4.3:official-fixture",
          "discount_eligible": true
        },
        {
          "name": "output_text_tokens",
          "quantity": "150",
          "unit": "token",
          "unit_price": "0.0000025",
          "cost": "0.000375",
          "price_card_id": "xai:grok-4.3:official-fixture",
          "discount_eligible": true
        },
        {
          "name": "output_reasoning_tokens",
          "quantity": "50",
          "unit": "token",
          "unit_price": "0.0000025",
          "cost": "0.000125",
          "price_card_id": "xai:grok-4.3:official-fixture",
          "discount_eligible": true,
          "metadata": {
            "pricing_policy": "xai_reasoning_tokens_priced_as_output_tokens",
            "priced_as_component": "output_text_tokens"
          }
        }
      ],
      "total": "0.001645",
      "price_sources": [
        {
          "name": "xAI pricing page",
          "url": "https://docs.x.ai/developers/pricing",
          "retrieved_at": "2026-06-07T00:00:00Z"
        }
      ],
      "applied_discounts": [],
      "warnings": []
    }
  }
}
