{
  "name": "deepseek-peak-pricing-boundary-second-end",
  "description": "Treats the exact end of the second DeepSeek peak window as regular pricing.",
  "metadata": {
    "requirement_ids": [
      "RC-FIXTURE-CONFORMANCE",
      "RC-PRICING-PERIOD"
    ],
    "provider": "deepseek",
    "surface": "deepseek.chat_completions",
    "scenario": "normalized_usage",
    "tags": [
      "component:output_text_tokens",
      "pricing_period",
      "normalized_usage"
    ],
    "expected_languages": [
      "python",
      "javascript",
      "go"
    ]
  },
  "input": {
    "usage_ledger": {
      "schema_version": "0.1",
      "provider": "deepseek",
      "surface": "deepseek.chat_completions",
      "model": {
        "requested": "deepseek-v4-pro",
        "billed": "deepseek-v4-pro",
        "alias_resolution": "none"
      },
      "context": {
        "priced_at": "2026-07-15T10:00:00Z"
      },
      "components": [
        {
          "name": "output_text_tokens",
          "quantity": "1000000",
          "unit": "token"
        }
      ]
    },
    "price_cards": [
      {
        "schema_version": "0.1",
        "id": "deepseek:deepseek-v4-pro:regular:fixture",
        "provider": "deepseek",
        "surface": "deepseek.chat_completions",
        "model": "deepseek-v4-pro",
        "pricing_period": "regular",
        "billing_schedule": {
          "timezone": "UTC",
          "default_period": "regular",
          "boundary_policy": "start_inclusive_end_exclusive",
          "windows": [
            {
              "period": "peak",
              "start": "01:00",
              "end": "04:00"
            },
            {
              "period": "peak",
              "start": "06:00",
              "end": "10:00"
            }
          ]
        },
        "effective": {
          "from": "2026-07-15"
        },
        "components": [
          {
            "usage_component": "output_text_tokens",
            "unit": "token",
            "price": {
              "amount": "0.87",
              "currency": "USD",
              "per": "1000000"
            }
          }
        ],
        "source": {
          "name": "fixture",
          "retrieved_at": "2026-07-15T00:00:00Z"
        }
      },
      {
        "schema_version": "0.1",
        "id": "deepseek:deepseek-v4-pro:peak:fixture",
        "provider": "deepseek",
        "surface": "deepseek.chat_completions",
        "model": "deepseek-v4-pro",
        "pricing_period": "peak",
        "billing_schedule": {
          "timezone": "UTC",
          "default_period": "regular",
          "boundary_policy": "start_inclusive_end_exclusive",
          "windows": [
            {
              "period": "peak",
              "start": "01:00",
              "end": "04:00"
            },
            {
              "period": "peak",
              "start": "06:00",
              "end": "10:00"
            }
          ]
        },
        "effective": {
          "from": "2026-07-15"
        },
        "components": [
          {
            "usage_component": "output_text_tokens",
            "unit": "token",
            "price": {
              "amount": "1.74",
              "currency": "USD",
              "per": "1000000"
            }
          }
        ],
        "source": {
          "name": "fixture",
          "retrieved_at": "2026-07-15T00:00:00Z"
        }
      }
    ]
  },
  "expected": {
    "cost_ledger": {
      "schema_version": "0.1",
      "provider": "deepseek",
      "surface": "deepseek.chat_completions",
      "model": {
        "requested": "deepseek-v4-pro",
        "billed": "deepseek-v4-pro",
        "alias_resolution": "none"
      },
      "currency": "USD",
      "components": [
        {
          "name": "output_text_tokens",
          "quantity": "1000000",
          "unit": "token",
          "unit_price": "0.00000087",
          "cost": "0.87",
          "price_card_id": "deepseek:deepseek-v4-pro:regular:fixture",
          "discount_eligible": true,
          "metadata": {
            "pricing_period": "regular",
            "period_selection": "derived_from_priced_at"
          }
        }
      ],
      "total": "0.87",
      "price_sources": [
        {
          "name": "fixture",
          "retrieved_at": "2026-07-15T00:00:00Z"
        }
      ],
      "applied_discounts": [],
      "warnings": []
    }
  }
}
