{
  "name": "google-interactions-total-usage-metadata",
  "description": "Extracts Google Interactions stream metadata.total_usage using the v2.9.0 field name, modality usage names, grounding counts, and service-tier selection.",
  "metadata": {
    "requirement_ids": [
      "RC-FIXTURE-CONFORMANCE",
      "RC-RAW-EXTRACTOR",
      "RC-SERVICE-TIER",
      "RC-TOOL-PRICING"
    ],
    "provider": "google",
    "surface": "google.gemini.interactions",
    "scenario": "raw_provider_response",
    "tags": [
      "component:input_uncached_tokens",
      "component:input_cache_read_tokens",
      "component:output_text_tokens",
      "component:output_reasoning_tokens",
      "component:output_audio_tokens",
      "component:web_search_units",
      "component:tool_call_units",
      "google",
      "interactions",
      "raw_provider_response",
      "service_tier",
      "tool_pricing"
    ],
    "expected_languages": [
      "python",
      "javascript",
      "go"
    ]
  },
  "input": {
    "raw_response": {
      "stream": [
        {
          "event_type": "interaction.created",
          "event_id": "evt_created"
        },
        {
          "event_type": "interaction.completed",
          "event_id": "evt_completed",
          "interaction": {
            "model": "gemini-3.5-flash",
            "service_tier": "priority"
          },
          "metadata": {
            "total_usage": {
              "input_tokens_by_modality": [
                {
                  "modality": "text",
                  "tokens": 80
                },
                {
                  "modality": "document",
                  "tokens": 40
                }
              ],
              "cached_tokens_by_modality": [
                {
                  "modality": "text",
                  "tokens": 20
                }
              ],
              "output_tokens_by_modality": [
                {
                  "modality": "text",
                  "tokens": 25
                },
                {
                  "modality": "audio",
                  "tokens": 15
                }
              ],
              "tool_use_tokens_by_modality": [
                {
                  "modality": "text",
                  "tokens": 10
                }
              ],
              "grounding_tool_count": [
                {
                  "type": "google_search",
                  "count": 2
                },
                {
                  "type": "retrieval",
                  "count": 1
                }
              ],
              "total_input_tokens": 120,
              "total_cached_tokens": 20,
              "total_output_tokens": 40,
              "total_thought_tokens": 5,
              "total_tool_use_tokens": 10,
              "total_tokens": 175
            }
          }
        }
      ]
    },
    "extract": {
      "provider": "google",
      "surface": "google.gemini.interactions",
      "model": "gemini-3.5-flash"
    },
    "price_cards": [
      {
        "schema_version": "0.1",
        "id": "google:gemini-3.5-flash:interactions-standard",
        "provider": "google",
        "surface": "google.gemini.interactions",
        "model": "gemini-3.5-flash",
        "service_tier": "standard",
        "components": [
          {
            "usage_component": "input_uncached_tokens",
            "unit": "token",
            "price": {
              "amount": "2",
              "currency": "USD",
              "per": "1000000"
            }
          },
          {
            "usage_component": "input_cache_read_tokens",
            "unit": "token",
            "price": {
              "amount": "0.50",
              "currency": "USD",
              "per": "1000000"
            }
          },
          {
            "usage_component": "output_text_tokens",
            "unit": "token",
            "price": {
              "amount": "10",
              "currency": "USD",
              "per": "1000000"
            }
          },
          {
            "usage_component": "output_reasoning_tokens",
            "unit": "token",
            "price": {
              "amount": "10",
              "currency": "USD",
              "per": "1000000"
            }
          },
          {
            "usage_component": "output_audio_tokens",
            "unit": "token",
            "price": {
              "amount": "12",
              "currency": "USD",
              "per": "1000000"
            }
          },
          {
            "usage_component": "web_search_units",
            "unit": "search",
            "price": {
              "amount": "0.02",
              "currency": "USD",
              "per": "1"
            }
          },
          {
            "usage_component": "tool_call_units",
            "unit": "call",
            "price": {
              "amount": "0.002",
              "currency": "USD",
              "per": "1"
            }
          }
        ],
        "source": {
          "name": "fixture",
          "retrieved_at": "2026-06-19T00:00:00Z"
        }
      },
      {
        "schema_version": "0.1",
        "id": "google:gemini-3.5-flash:interactions-priority",
        "provider": "google",
        "surface": "google.gemini.interactions",
        "model": "gemini-3.5-flash",
        "service_tier": "priority",
        "components": [
          {
            "usage_component": "input_uncached_tokens",
            "unit": "token",
            "price": {
              "amount": "1",
              "currency": "USD",
              "per": "1000000"
            }
          },
          {
            "usage_component": "input_cache_read_tokens",
            "unit": "token",
            "price": {
              "amount": "0.25",
              "currency": "USD",
              "per": "1000000"
            }
          },
          {
            "usage_component": "output_text_tokens",
            "unit": "token",
            "price": {
              "amount": "5",
              "currency": "USD",
              "per": "1000000"
            }
          },
          {
            "usage_component": "output_reasoning_tokens",
            "unit": "token",
            "price": {
              "amount": "5",
              "currency": "USD",
              "per": "1000000"
            }
          },
          {
            "usage_component": "output_audio_tokens",
            "unit": "token",
            "price": {
              "amount": "6",
              "currency": "USD",
              "per": "1000000"
            }
          },
          {
            "usage_component": "web_search_units",
            "unit": "search",
            "price": {
              "amount": "0.01",
              "currency": "USD",
              "per": "1"
            }
          },
          {
            "usage_component": "tool_call_units",
            "unit": "call",
            "price": {
              "amount": "0.001",
              "currency": "USD",
              "per": "1"
            }
          }
        ],
        "source": {
          "name": "fixture",
          "retrieved_at": "2026-06-19T00:00:00Z"
        }
      }
    ]
  },
  "expected": {
    "cost_ledger": {
      "schema_version": "0.1",
      "provider": "google",
      "surface": "google.gemini.interactions",
      "model": {
        "requested": "gemini-3.5-flash",
        "returned": "gemini-3.5-flash",
        "billed": "gemini-3.5-flash",
        "alias_resolution": "none"
      },
      "currency": "USD",
      "components": [
        {
          "name": "input_uncached_tokens",
          "quantity": "110",
          "unit": "token",
          "unit_price": "0.000001",
          "cost": "0.00011",
          "price_card_id": "google:gemini-3.5-flash:interactions-priority",
          "discount_eligible": true
        },
        {
          "name": "input_cache_read_tokens",
          "quantity": "20",
          "unit": "token",
          "unit_price": "0.00000025",
          "cost": "0.000005",
          "price_card_id": "google:gemini-3.5-flash:interactions-priority",
          "discount_eligible": true
        },
        {
          "name": "output_text_tokens",
          "quantity": "25",
          "unit": "token",
          "unit_price": "0.000005",
          "cost": "0.000125",
          "price_card_id": "google:gemini-3.5-flash:interactions-priority",
          "discount_eligible": true
        },
        {
          "name": "output_reasoning_tokens",
          "quantity": "5",
          "unit": "token",
          "unit_price": "0.000005",
          "cost": "0.000025",
          "price_card_id": "google:gemini-3.5-flash:interactions-priority",
          "discount_eligible": true
        },
        {
          "name": "output_audio_tokens",
          "quantity": "15",
          "unit": "token",
          "unit_price": "0.000006",
          "cost": "0.00009",
          "price_card_id": "google:gemini-3.5-flash:interactions-priority",
          "discount_eligible": true
        },
        {
          "name": "web_search_units",
          "quantity": "2",
          "unit": "search",
          "unit_price": "0.01",
          "cost": "0.02",
          "price_card_id": "google:gemini-3.5-flash:interactions-priority",
          "discount_eligible": true
        },
        {
          "name": "tool_call_units",
          "quantity": "1",
          "unit": "call",
          "unit_price": "0.001",
          "cost": "0.001",
          "price_card_id": "google:gemini-3.5-flash:interactions-priority",
          "discount_eligible": true
        }
      ],
      "total": "0.021355",
      "price_sources": [
        {
          "name": "fixture",
          "retrieved_at": "2026-06-19T00:00:00Z"
        }
      ],
      "applied_discounts": [],
      "warnings": []
    }
  }
}
