{
  "name": "openai-gpt-56-luna-price-before-july-30",
  "description": "Selects the historical gpt-5.6-luna rate at the July 30, 2026 effective-date boundary.",
  "metadata": {
    "requirement_ids": [
      "RC-FIXTURE-CONFORMANCE",
      "RC-SOURCE-ADAPTER"
    ],
    "provider": "openai",
    "surface": "openai.responses",
    "scenario": "source_adapter",
    "tags": [
      "component:input_uncached_tokens",
      "effective_date",
      "gpt_5_6_price_transition",
      "source:official-snapshot",
      "source_adapter"
    ],
    "expected_languages": [
      "python",
      "javascript",
      "go"
    ]
  },
  "input": {
    "usage_ledger": {
      "schema_version": "0.1",
      "provider": "openai",
      "surface": "openai.responses",
      "model": {
        "requested": "gpt-5.6-luna",
        "billed": "gpt-5.6-luna",
        "alias_resolution": "none"
      },
      "context": {
        "priced_at": "2026-07-29T23:59:59Z",
        "service_tier": "standard"
      },
      "components": [
        {
          "name": "input_uncached_tokens",
          "quantity": "1000000",
          "unit": "token"
        }
      ]
    },
    "price_source": {
      "type": "official-snapshot",
      "data": {
        "provider": "openai",
        "surface": "openai.responses",
        "per": "1000000",
        "source": {
          "name": "OpenAI GPT-5.6 July 30 transition fixture",
          "url": "https://developers.openai.com/api/docs/pricing",
          "retrieved_at": "2026-07-31T00:40:00Z",
          "license": "reviewed"
        },
        "rows": [
          {
            "model": "gpt-5.6-luna",
            "service_tier": "standard",
            "price_card_id": "openai:gpt-5.6-luna:standard:transition-fixture:through-2026-07-29",
            "effective": {
              "from": "2026-06-26",
              "to": "2026-07-29"
            },
            "input": "1"
          },
          {
            "model": "gpt-5.6-luna",
            "service_tier": "standard",
            "price_card_id": "openai:gpt-5.6-luna:standard:transition-fixture",
            "effective": {
              "from": "2026-07-30"
            },
            "input": "0.2"
          }
        ]
      }
    }
  },
  "expected": {
    "cost_ledger": {
      "schema_version": "0.1",
      "provider": "openai",
      "surface": "openai.responses",
      "model": {
        "requested": "gpt-5.6-luna",
        "billed": "gpt-5.6-luna",
        "alias_resolution": "none"
      },
      "currency": "USD",
      "components": [
        {
          "name": "input_uncached_tokens",
          "quantity": "1000000",
          "unit": "token",
          "unit_price": "0.000001",
          "cost": "1",
          "price_card_id": "openai:gpt-5.6-luna:standard:transition-fixture:through-2026-07-29",
          "discount_eligible": true
        }
      ],
      "total": "1",
      "price_sources": [
        {
          "name": "OpenAI GPT-5.6 July 30 transition fixture",
          "url": "https://developers.openai.com/api/docs/pricing",
          "retrieved_at": "2026-07-31T00:40:00Z",
          "license": "reviewed"
        }
      ],
      "applied_discounts": [],
      "warnings": []
    }
  }
}
