{
  "name": "anthropic-messages-fable-sticky-fallback-inferred",
  "description": "Conservatively normal-prices an ambiguous sticky fallback_message Opus iteration when the caller did not pass the requested Fable model and no fallback boundary is present.",
  "metadata": {
    "requirement_ids": [
      "RC-FIXTURE-CONFORMANCE",
      "RC-RAW-EXTRACTOR"
    ],
    "provider": "anthropic",
    "surface": "anthropic.messages",
    "scenario": "raw_provider_response",
    "tags": [
      "ambiguous_fallback",
      "component:input_uncached_tokens",
      "component:output_text_tokens",
      "raw_provider_response",
      "sticky_fallback"
    ],
    "expected_languages": [
      "python",
      "javascript",
      "go"
    ]
  },
  "input": {
    "extract": {
      "provider": "anthropic",
      "surface": "anthropic.messages"
    },
    "raw_response": {
      "id": "msg_fable_sticky_inferred_fixture",
      "type": "message",
      "role": "assistant",
      "model": "claude-opus-4-8",
      "content": [
        {
          "type": "text",
          "text": "Sticky fallback answer."
        }
      ],
      "stop_reason": "end_turn",
      "stop_details": null,
      "usage": {
        "input_tokens": 300,
        "output_tokens": 80,
        "cache_read_input_tokens": 0,
        "cache_creation_input_tokens": 0,
        "iterations": [
          {
            "type": "fallback_message",
            "model": "claude-opus-4-8",
            "input_tokens": 300,
            "output_tokens": 80,
            "cache_read_input_tokens": 0,
            "cache_creation_input_tokens": 0
          }
        ]
      }
    },
    "price_cards": [
      {
        "schema_version": "0.1",
        "id": "anthropic:claude-opus-4-8:sticky-inferred-fixture",
        "provider": "anthropic",
        "surface": "anthropic.messages",
        "model": "claude-opus-4-8",
        "components": [
          {
            "usage_component": "input_uncached_tokens",
            "unit": "token",
            "price": {
              "amount": "0.000005",
              "currency": "USD",
              "per": "1"
            }
          },
          {
            "usage_component": "input_cache_read_tokens",
            "unit": "token",
            "price": {
              "amount": "0.0000005",
              "currency": "USD",
              "per": "1"
            }
          },
          {
            "usage_component": "output_text_tokens",
            "unit": "token",
            "price": {
              "amount": "0.000025",
              "currency": "USD",
              "per": "1"
            }
          }
        ],
        "source": {
          "name": "fixture",
          "retrieved_at": "2026-06-19T00:00:00Z"
        }
      }
    ]
  },
  "expected": {
    "cost_ledger": {
      "schema_version": "0.1",
      "provider": "anthropic",
      "surface": "anthropic.messages",
      "model": {
        "requested": "claude-opus-4-8",
        "returned": "claude-opus-4-8",
        "billed": "claude-opus-4-8",
        "alias_resolution": "none"
      },
      "currency": "USD",
      "components": [
        {
          "name": "input_uncached_tokens",
          "quantity": "300",
          "unit": "token",
          "unit_price": "0.000005",
          "cost": "0.0015",
          "price_card_id": "anthropic:claude-opus-4-8:sticky-inferred-fixture",
          "discount_eligible": true,
          "metadata": {
            "billing_model": "claude-opus-4-8",
            "usage_iteration_index": 0,
            "usage_iteration_type": "fallback_message"
          }
        },
        {
          "name": "output_text_tokens",
          "quantity": "80",
          "unit": "token",
          "unit_price": "0.000025",
          "cost": "0.002",
          "price_card_id": "anthropic:claude-opus-4-8:sticky-inferred-fixture",
          "discount_eligible": true,
          "metadata": {
            "billing_model": "claude-opus-4-8",
            "usage_iteration_index": 0,
            "usage_iteration_type": "fallback_message"
          }
        }
      ],
      "total": "0.0035",
      "price_sources": [
        {
          "name": "fixture",
          "retrieved_at": "2026-06-19T00:00:00Z"
        }
      ],
      "applied_discounts": [],
      "warnings": []
    }
  }
}
