{
  "name": "deepseek-weekly-pricing-effective-before-start",
  "description": "Selects the older card one second before the precise RFC3339 effective start; the precise card is not yet applicable.",
  "metadata": {
    "requirement_ids": ["RC-CALC-CORE", "RC-FIXTURE-CONFORMANCE", "RC-PRICING-PERIOD"],
    "provider": "deepseek",
    "surface": "deepseek.chat_completions",
    "scenario": "normalized_usage",
    "tags": ["component:output_text_tokens", "effective_date_time", "pricing_period", "timezone", "boundary", "normalized_usage"],
    "expected_languages": ["python", "javascript", "go"]
  },
  "input": {
    "usage_ledger": {
      "schema_version": "0.1",
      "provider": "deepseek",
      "surface": "deepseek.chat_completions",
      "model": {
        "requested": "deepseek-v4-pro",
        "billed": "deepseek-v4-pro",
        "alias_resolution": "none"
      },
      "context": {"priced_at": "2026-08-22T15:59:59Z"},
      "components": [{"name": "output_text_tokens", "quantity": "1000000", "unit": "token"}]
    },
    "price_cards": [
      {
        "schema_version": "0.1",
        "id": "synthetic:deepseek-v4-pro:effective:before-start",
        "provider": "deepseek",
        "surface": "deepseek.chat_completions",
        "model": "deepseek-v4-pro",
        "pricing_period": "offpeak",
        "billing_schedule": {
          "timezone": "Asia/Shanghai",
          "default_period": "offpeak",
          "boundary_policy": "start_inclusive_end_exclusive",
          "windows": [{
            "period": "peak",
            "start": "09:00",
            "end": "18:00",
            "days_of_week": ["monday", "tuesday", "wednesday", "thursday", "friday"]
          }]
        },
        "effective": {
          "from": "2026-08-01T00:00:00Z",
          "to": "2026-08-22T16:00:00Z"
        },
        "components": [{
          "usage_component": "output_text_tokens",
          "unit": "token",
          "price": {"amount": "1", "currency": "USD", "per": "1000000"}
        }],
        "source": {"name": "synthetic-deepseek-weekly-pricing"}
      },
      {
        "schema_version": "0.1",
        "id": "synthetic:deepseek-v4-pro:effective:from-start",
        "provider": "deepseek",
        "surface": "deepseek.chat_completions",
        "model": "deepseek-v4-pro",
        "pricing_period": "offpeak",
        "billing_schedule": {
          "timezone": "Asia/Shanghai",
          "default_period": "offpeak",
          "boundary_policy": "start_inclusive_end_exclusive",
          "windows": [{
            "period": "peak",
            "start": "09:00",
            "end": "18:00",
            "days_of_week": ["monday", "tuesday", "wednesday", "thursday", "friday"]
          }]
        },
        "effective": {"from": "2026-08-22T16:00:00Z"},
        "components": [{
          "usage_component": "output_text_tokens",
          "unit": "token",
          "price": {"amount": "3", "currency": "USD", "per": "1000000"}
        }],
        "source": {"name": "synthetic-deepseek-weekly-pricing"}
      }
    ]
  },
  "expected": {
    "cost_ledger": {
      "schema_version": "0.1",
      "provider": "deepseek",
      "surface": "deepseek.chat_completions",
      "model": {
        "requested": "deepseek-v4-pro",
        "billed": "deepseek-v4-pro",
        "alias_resolution": "none"
      },
      "currency": "USD",
      "components": [{
        "name": "output_text_tokens",
        "quantity": "1000000",
        "unit": "token",
        "unit_price": "0.000001",
        "cost": "1",
        "price_card_id": "synthetic:deepseek-v4-pro:effective:before-start",
        "discount_eligible": true,
        "metadata": {
          "pricing_period": "offpeak",
          "period_selection": "derived_from_priced_at",
          "pricing_window": "default",
          "pricing_timezone": "Asia/Shanghai"
        }
      }],
      "total": "1",
      "price_sources": [{"name": "synthetic-deepseek-weekly-pricing"}],
      "applied_discounts": [],
      "warnings": []
    }
  }
}
